{
  "schema_version": "eiel_work_item_v1",
  "work_id": "WORK-W32-QUALIFICATION",
  "title": "Qualify W32 CUDA route",
  "summary": "Complete the bounded technical qualification needed by the paused W32 campaign.",
  "work_type": "QUALIFICATION",
  "priority": "P1",
  "completion_policy": "QUALIFICATION_DECISION",
  "completion_basis": null,
  "accepted": false,
  "mission_id": "MIS-W32-QUALIFICATION",
  "parent_work_id": "WORK-W32-CAMPAIGN",
  "dependency_work_ids": ["WORK-VRAM-REDUCTION"],
  "tags": ["w32", "cuda", "qualification"],
  "current_stage": "blocked",
  "current_step": "await VRAM envelope repair",
  "last_completed_step": "qualification plan generated",
  "next_action": "Resume the qualification after WORK-VRAM-REDUCTION completes.",
  "next_command": "python -m tools.eiel workManager resume WORK-W32-QUALIFICATION",
  "blocked_reason": "Current route exceeds the admitted VRAM envelope.",
  "preferred_codex_conversation_id": "00000000-0000-4000-8000-000000000001",
  "preferred_codex_thread_url": "https://example.invalid/conversation",
  "superseded_by_work_id": null,
  "references": {
    "qualification_record_ids": [],
    "resource_record_ids": [],
    "evidence_assessment_ids": [],
    "artifact_paths": [],
    "report_paths": [],
    "librarian_document_ids": [],
    "external_urls": []
  },
  "created_order_key": "2026-08-04T00:00:00Z"
}
